{
 "schema_version": "0.1",
 "id": "CN216792560U-ex6",
 "source": {
  "patent": "CN216792560U",
  "url": "https://patents.google.com/patent/CN216792560U/zh",
  "title": "Imaging lens",
  "assignee": "Zhejiang Sunny Optics Co Ltd",
  "date": "2022-06-21",
  "embodiment": 6,
  "table": "Table 27",
  "pdf_url": "https://patentimages.storage.googleapis.com/90/1b/f9/cc336b6e80871e/CN216792560U.pdf"
 },
 "claimed": {
  "ttl": 7.72,
  "imgh": 4.9,
  "hfov_deg": 40.23,
  "fno": 1.9
 },
 "wavelengths_um": [
  0.4861327,
  0.5875618,
  0.6562725
 ],
 "primary_wavelength_um": 0.5875618,
 "surfaces": [
  {
   "name": "OBJ",
   "radius": "inf",
   "thickness": "inf",
   "conic": 0.0,
   "is_stop": false,
   "role": "object"
  },
  {
   "name": "S3",
   "radius": -550.0,
   "thickness": 0.07,
   "nd": 1.41,
   "vd": 50.0,
   "conic": 0.0,
   "is_stop": false,
   "role": "surface"
  },
  {
   "name": "S4",
   "radius": -550.0,
   "thickness": 0.2,
   "nd": 1.29,
   "vd": 100.0,
   "conic": 0.0,
   "is_stop": false,
   "role": "surface"
  },
  {
   "name": "S5",
   "radius": "inf",
   "thickness": 0.02,
   "nd": 1.41,
   "vd": 50.0,
   "conic": 0.0,
   "is_stop": false,
   "role": "surface"
  },
  {
   "name": "S6",
   "radius": "inf",
   "thickness": 0.21,
   "nd": 1.52,
   "vd": 64.2,
   "conic": 0.0,
   "is_stop": false,
   "role": "surface"
  },
  {
   "name": "S7",
   "radius": "inf",
   "thickness": 0.2536,
   "conic": 0.0,
   "is_stop": false,
   "role": "surface"
  },
  {
   "name": "IMA",
   "radius": "inf",
   "thickness": 0.0,
   "conic": 0.0,
   "is_stop": false,
   "role": "image"
  }
 ],
 "provenance": {
  "method": "google_patents_text_table",
  "extractor": "lenszoo.extract.gpatents 0.1",
  "aspheric_tables": 0,
  "warnings": [
   "no image row in table; appended image after last row"
  ]
 },
 "verification": {
  "status": "needs_review",
  "checks": {
   "ttl": {
    "claimed": 7.72,
    "computed": 0.7536,
    "abs_err": -6.9664,
    "pass": false
   },
   "imgh": {
    "claimed": 4.9,
    "computed": 0.4751,
    "rel_err": -0.903,
    "pass": false
   },
   "focus": {
    "defocus_mm": -1897.2119,
    "dof_mm": 0.0042,
    "pass": false
   },
   "image_quality": {
    "rms_um_mean": 379505.7,
    "limit_um": 15.0,
    "pass": false
   }
  },
  "metrics": {
   "efl": -1896.58077,
   "fno": 1.9,
   "ttl": 0.7536,
   "defocus": -1897.21194,
   "hfov_deg": 40.23,
   "assumptions": [
    "no stop labelled: stop placed at first refracting surface"
   ],
   "n_lenses": 2,
   "imgh_real": 0.47515,
   "distortion_pct": -8.01702,
   "mtf_freq_lpmm": 223.92605,
   "fields": [
    {
     "Hy": 0.0,
     "rms_um": 440698.41133,
     "mtf_t": 0.14252,
     "mtf_s": 0.14062,
     "vignetted_frac": 0.0,
     "outlier_frac": 0.0
    },
    {
     "Hy": 0.5,
     "rms_um": 384641.36453,
     "mtf_t": 0.08792,
     "mtf_s": 0.07609,
     "vignetted_frac": 0.19685,
     "outlier_frac": 0.0
    },
    {
     "Hy": 0.7,
     "rms_um": 371788.43629,
     "mtf_t": 0.10976,
     "mtf_s": 0.01636,
     "vignetted_frac": 0.25197,
     "outlier_frac": 0.0
    },
    {
     "Hy": 0.85,
     "rms_um": 355384.14792,
     "mtf_t": 0.01587,
     "mtf_s": 0.15063,
     "vignetted_frac": 0.31496,
     "outlier_frac": 0.0
    },
    {
     "Hy": 1.0,
     "rms_um": 345016.139,
     "mtf_t": 0.16247,
     "mtf_s": 0.03883,
     "vignetted_frac": 0.34646,
     "outlier_frac": 0.0
    }
   ],
   "rms_um_mean": 379505.69981,
   "full_field_vignetted": false,
   "mtf_mean": 0.09411,
   "airy_um": 1.36206,
   "min_center_thickness": 0.02,
   "min_edge_thickness": null
  },
  "tolerances": {
   "efl_rel": 0.01,
   "ttl_abs": 0.02,
   "ttl_rel": 0.005,
   "imgh_rel": 0.03,
   "defocus_dof": 3.0,
   "rms_um": 15.0
  },
  "refined": {
   "nd": {
    "1.41/50.0": 1.405,
    "1.29/100.0": 1.295,
    "1.52/64.2": 1.525
   },
   "checks": {
    "ttl": {
     "claimed": 7.72,
     "computed": 0.7536,
     "abs_err": -6.9664,
     "pass": false
    },
    "imgh": {
     "claimed": 4.9,
     "computed": 0.4744,
     "rel_err": -0.9032,
     "pass": false
    },
    "focus": {
     "defocus_mm": -1865.0607,
     "dof_mm": 0.0042,
     "pass": false
    },
    "image_quality": {
     "rms_um_mean": 371593.631,
     "limit_um": 15.0,
     "pass": false
    }
   },
   "metrics": {
    "efl": -1864.43229,
    "fno": 1.9,
    "ttl": 0.7536,
    "defocus": -1865.06067,
    "hfov_deg": 40.23,
    "assumptions": [
     "no stop labelled: stop placed at first refracting surface"
    ],
    "n_lenses": 2,
    "imgh_real": 0.47437,
    "distortion_pct": -8.04373,
    "mtf_freq_lpmm": 223.92605,
    "fields": [
     {
      "Hy": 0.0,
      "rms_um": 428820.89451,
      "mtf_t": 0.18189,
      "mtf_s": 0.09376,
      "vignetted_frac": 0.0,
      "outlier_frac": 0.0
     },
     {
      "Hy": 0.5,
      "rms_um": 383023.05103,
      "mtf_t": 0.03154,
      "mtf_s": 0.13173,
      "vignetted_frac": 0.1811,
      "outlier_frac": 0.0
     },
     {
      "Hy": 0.7,
      "rms_um": 364190.106,
      "mtf_t": 0.0276,
      "mtf_s": 0.00507,
      "vignetted_frac": 0.24409,
      "outlier_frac": 0.0
     },
     {
      "Hy": 0.85,
      "rms_um": 345908.23249,
      "mtf_t": 0.03736,
      "mtf_s": 0.02334,
      "vignetted_frac": 0.31496,
      "outlier_frac": 0.0
     },
     {
      "Hy": 1.0,
      "rms_um": 336025.87332,
      "mtf_t": 0.08345,
      "mtf_s": 0.02463,
      "vignetted_frac": 0.34646,
      "outlier_frac": 0.0
     }
    ],
    "rms_um_mean": 371593.63147,
    "full_field_vignetted": false,
    "mtf_mean": 0.06404,
    "airy_um": 1.36206,
    "min_center_thickness": 0.02,
    "min_edge_thickness": null
   }
  },
  "notes": [
   "no image row in table; appended image after last row"
  ],
  "failed_checks": [
   "ttl",
   "imgh",
   "focus",
   "image_quality"
  ]
 }
}