{
 "schema_version": "0.1",
 "id": "CN105116519B-ex7",
 "source": {
  "patent": "CN105116519B",
  "url": "https://patents.google.com/patent/CN105116519B/zh",
  "title": "Imaging lens",
  "assignee": "Zhejiang Sunny Optics Co Ltd",
  "date": "2017-11-14",
  "embodiment": 7,
  "table": "Table 14",
  "pdf_url": "https://patentimages.storage.googleapis.com/c8/d9/ba/5a1b41be357d09/CN105116519B.pdf"
 },
 "claimed": {
  "efl": 4.31,
  "ttl": 4.75,
  "fno": 2.4,
  "hfov_deg": 29.11
 },
 "wavelengths_um": [
  0.4861327,
  0.5875618,
  0.6562725
 ],
 "primary_wavelength_um": 0.5875618,
 "surfaces": [
  {
   "name": "OBJ",
   "radius": "inf",
   "thickness": "inf",
   "conic": 0.0,
   "is_stop": false,
   "role": "object"
  },
  {
   "name": "STO",
   "radius": "inf",
   "thickness": -0.2831,
   "conic": 0.0,
   "is_stop": true,
   "role": "stop"
  },
  {
   "name": "S1",
   "radius": 1.4376,
   "thickness": 0.6299,
   "nd": 1.544,
   "vd": 56.11,
   "conic": -0.5571,
   "aspheric": {
    "A4": 0.02366,
    "A6": 0.0071377,
    "A8": -0.02253,
    "A10": 0.015606,
    "A12": -0.023843,
    "A14": -0.0040671,
    "A16": -0.012677
   },
   "is_stop": false,
   "role": "surface"
  },
  {
   "name": "S2",
   "radius": 103.1281,
   "thickness": 0.0333,
   "conic": 99.99,
   "aspheric": {
    "A4": -0.037444,
    "A6": -0.0064289,
    "A8": 0.023509,
    "A10": -0.042442,
    "A12": 0.0053289,
    "A14": -0.0060571,
    "A16": 0.00035948
   },
   "is_stop": false,
   "role": "surface"
  },
  {
   "name": "S3",
   "radius": -110.608,
   "thickness": 0.2385,
   "nd": 1.64,
   "vd": 23.53,
   "conic": 99.99,
   "aspheric": {
    "A4": 0.012336,
    "A6": 0.036192,
    "A8": 0.048625,
    "A10": -0.029255,
    "A12": 0.041514,
    "A14": -0.006356,
    "A16": 0.0044253
   },
   "is_stop": false,
   "role": "surface"
  },
  {
   "name": "S4",
   "radius": 4.9348,
   "thickness": 0.4626,
   "conic": 28.248,
   "aspheric": {
    "A4": 0.028505,
    "A6": 0.056236,
    "A8": -0.034324,
    "A10": 0.054836,
    "A12": 0.026992,
    "A14": 0.017861,
    "A16": -0.0038843
   },
   "is_stop": false,
   "role": "surface"
  },
  {
   "name": "S5",
   "radius": -5.71,
   "thickness": 0.2515,
   "nd": 1.64,
   "vd": 23.53,
   "conic": 27.4845,
   "aspheric": {
    "A4": -0.11295,
    "A6": -0.0058532,
    "A8": -0.030597,
    "A10": 0.066679,
    "A12": -0.036256,
    "A14": 0.029802,
    "A16": -0.013726
   },
   "is_stop": false,
   "role": "surface"
  },
  {
   "name": "S6",
   "radius": -21.9954,
   "thickness": 0.033,
   "conic": -97.339,
   "aspheric": {
    "A4": -0.079201,
    "A6": 0.024553,
    "A8": -0.021239,
    "A10": 0.054953,
    "A12": -0.01941,
    "A14": 0.0091096,
    "A16": -0.0062932
   },
   "is_stop": false,
   "role": "surface"
  },
  {
   "name": "S7",
   "radius": -6.9912,
   "thickness": 0.4971,
   "nd": 1.535,
   "vd": 55.8,
   "conic": 4.2051,
   "aspheric": {
    "A4": 0.004898,
    "A6": 0.0067728,
    "A8": 0.0040247,
    "A10": 0.0043151,
    "A12": 0.0035052,
    "A14": 0.00096273,
    "A16": -0.0031289
   },
   "is_stop": false,
   "role": "surface"
  },
  {
   "name": "S8",
   "radius": -3.8561,
   "thickness": 0.1114,
   "conic": -54.1562,
   "aspheric": {
    "A4": -0.10109,
    "A6": 0.0304,
    "A8": -0.034359,
    "A10": 0.04197,
    "A12": -0.026918,
    "A14": 0.0079475,
    "A16": -0.00087565
   },
   "is_stop": false,
   "role": "surface"
  },
  {
   "name": "S9",
   "radius": -4.5101,
   "thickness": 0.3275,
   "nd": 1.64,
   "vd": 23.53,
   "conic": -25.8409,
   "aspheric": {
    "A4": -0.088649,
    "A6": 0.012265,
    "A8": -0.039213,
    "A10": 0.044639,
    "A12": -0.02428,
    "A14": 0.00857,
    "A16": -0.0019374
   },
   "is_stop": false,
   "role": "surface"
  },
  {
   "name": "S10",
   "radius": -5.037,
   "thickness": 0.1462,
   "conic": 3.6764,
   "aspheric": {
    "A4": -0.088724,
    "A6": 0.023483,
    "A8": -0.035388,
    "A10": 0.044016,
    "A12": -0.025179,
    "A14": 0.0084779,
    "A16": -0.0012901
   },
   "is_stop": false,
   "role": "surface"
  },
  {
   "name": "S11",
   "radius": 15.3178,
   "thickness": 0.47,
   "nd": 1.535,
   "vd": 55.8,
   "conic": 99.0,
   "aspheric": {
    "A4": -0.81754,
    "A6": -0.13363,
    "A8": 0.057661,
    "A10": -0.010307,
    "A12": 0.0033554,
    "A14": 0.0015822,
    "A16": 0.001397
   },
   "is_stop": false,
   "role": "surface"
  },
  {
   "name": "S12",
   "radius": 500.0,
   "thickness": 0.144,
   "conic": -74.0731,
   "aspheric": {
    "A4": 0.24861,
    "A6": -0.26239,
    "A8": 0.1312,
    "A10": -0.038566,
    "A12": 0.0065464,
    "A14": -0.00058189,
    "A16": 2.0414e-05
   },
   "is_stop": false,
   "role": "surface"
  },
  {
   "name": "S13",
   "radius": 1.7035,
   "thickness": 0.442,
   "nd": 1.535,
   "vd": 55.8,
   "conic": -1.2705,
   "aspheric": {
    "A4": -0.36602,
    "A6": 0.19497,
    "A8": -0.053231,
    "A10": 0.0071427,
    "A12": -0.0003078,
    "A14": -1.9937e-05,
    "A16": 1.6458e-06
   },
   "is_stop": false,
   "role": "surface"
  },
  {
   "name": "S14",
   "radius": 1.0619,
   "thickness": 0.1938,
   "conic": -4.3197,
   "aspheric": {
    "A4": -0.20613,
    "A6": 0.12468,
    "A8": -0.061358,
    "A10": 0.020054,
    "A12": -0.003812,
    "A14": 0.00037658,
    "A16": -1.4845e-05
   },
   "is_stop": false,
   "role": "surface"
  },
  {
   "name": "S15",
   "radius": "inf",
   "thickness": 0.21,
   "nd": 1.517,
   "vd": 64.17,
   "conic": 0.0,
   "is_stop": false,
   "role": "surface"
  },
  {
   "name": "S16",
   "radius": "inf",
   "thickness": 0.5446,
   "conic": 0.0,
   "is_stop": false,
   "role": "surface"
  },
  {
   "name": "S17",
   "radius": "inf",
   "thickness": 0.0,
   "conic": 0.0,
   "is_stop": false,
   "role": "image"
  }
 ],
 "provenance": {
  "method": "google_patents_text_table",
  "extractor": "lenszoo.extract.gpatents 0.1",
  "aspheric_tables": 1,
  "warnings": []
 },
 "verification": {
  "status": "needs_review",
  "checks": {
   "efl": {
    "claimed": 4.31,
    "computed": 4.3148,
    "rel_err": 0.0011,
    "pass": true
   },
   "ttl": {
    "claimed": 4.75,
    "computed": 4.7354,
    "abs_err": -0.0146,
    "pass": true
   },
   "focus": {
    "defocus_mm": 0.2245,
    "dof_mm": 0.0068,
    "pass": false
   },
   "image_quality": {
    "rms_um_mean": 440.306,
    "limit_um": 15.0,
    "pass": false
   }
  },
  "metrics": {
   "efl": 4.31481,
   "fno": 2.4,
   "ttl": 4.7354,
   "defocus": 0.22446,
   "hfov_deg": 29.11,
   "assumptions": [],
   "n_lenses": 7,
   "imgh_real": 2.99825,
   "distortion_pct": 35.61352,
   "mtf_freq_lpmm": 177.27479,
   "fields": [
    {
     "Hy": 0.0,
     "rms_um": 242.42043,
     "mtf_t": 0.05341,
     "mtf_s": 0.12377,
     "vignetted_frac": 0.0,
     "outlier_frac": 0.0
    },
    {
     "Hy": 0.5,
     "rms_um": 557.34918,
     "mtf_t": 0.01221,
     "mtf_s": 0.05182,
     "vignetted_frac": 0.0,
     "outlier_frac": 0.0
    },
    {
     "Hy": 0.7,
     "rms_um": 441.0506,
     "mtf_t": 0.04569,
     "mtf_s": 0.07669,
     "vignetted_frac": 0.0,
     "outlier_frac": 0.0
    },
    {
     "Hy": 0.85,
     "rms_um": 414.54529,
     "mtf_t": 0.03251,
     "mtf_s": 0.00434,
     "vignetted_frac": 0.13123,
     "outlier_frac": 0.0
    },
    {
     "Hy": 1.0,
     "rms_um": 546.16682,
     "mtf_t": 0.04297,
     "mtf_s": 0.00994,
     "vignetted_frac": 0.02362,
     "outlier_frac": 0.01344
    }
   ],
   "rms_um_mean": 440.30646,
   "full_field_vignetted": false,
   "mtf_mean": 0.04534,
   "airy_um": 1.72049,
   "min_center_thickness": 0.21,
   "min_edge_thickness": 0.21
  },
  "tolerances": {
   "efl_rel": 0.01,
   "ttl_abs": 0.02,
   "ttl_rel": 0.005,
   "imgh_rel": 0.03,
   "defocus_dof": 3.0,
   "rms_um": 15.0
  },
  "refined": {
   "nd": {
    "1.64/23.53": 1.635
   },
   "checks": {
    "efl": {
     "claimed": 4.31,
     "computed": 4.2826,
     "rel_err": -0.0064,
     "pass": true
    },
    "ttl": {
     "claimed": 4.75,
     "computed": 4.7354,
     "abs_err": -0.0146,
     "pass": true
    },
    "focus": {
     "defocus_mm": 0.2042,
     "dof_mm": 0.0068,
     "pass": false
    },
    "image_quality": {
     "rms_um_mean": 449.075,
     "limit_um": 15.0,
     "pass": false
    }
   },
   "metrics": {
    "efl": 4.28261,
    "fno": 2.4,
    "ttl": 4.7354,
    "defocus": 0.20417,
    "hfov_deg": 29.11,
    "assumptions": [],
    "n_lenses": 7,
    "imgh_real": 2.99812,
    "distortion_pct": 35.63765,
    "mtf_freq_lpmm": 177.27479,
    "fields": [
     {
      "Hy": 0.0,
      "rms_um": 229.54369,
      "mtf_t": 0.0303,
      "mtf_s": 0.02753,
      "vignetted_frac": 0.0,
      "outlier_frac": 0.0
     },
     {
      "Hy": 0.5,
      "rms_um": 546.63283,
      "mtf_t": 0.09101,
      "mtf_s": 0.07331,
      "vignetted_frac": 0.0,
      "outlier_frac": 0.0
     },
     {
      "Hy": 0.7,
      "rms_um": 429.04978,
      "mtf_t": 0.11166,
      "mtf_s": 0.06736,
      "vignetted_frac": 0.0,
      "outlier_frac": 0.0
     },
     {
      "Hy": 0.85,
      "rms_um": 406.15154,
      "mtf_t": 0.06473,
      "mtf_s": 0.05065,
      "vignetted_frac": 0.12336,
      "outlier_frac": 0.0
     },
     {
      "Hy": 1.0,
      "rms_um": 633.99561,
      "mtf_t": 0.04082,
      "mtf_s": 0.04808,
      "vignetted_frac": 0.0,
      "outlier_frac": 0.00262
     }
    ],
    "rms_um_mean": 449.07469,
    "full_field_vignetted": false,
    "mtf_mean": 0.06054,
    "airy_um": 1.72049,
    "min_center_thickness": 0.21,
    "min_edge_thickness": 0.20643
   }
  },
  "notes": [],
  "failed_checks": [
   "focus",
   "image_quality"
  ]
 }
}